<?xml version="1.0" encoding="UTF-8"?>
<CrossSectionalData xmlns:xsi="http://www.w3.org/2001/XMLSchema-instance"
        xsi:noNamespaceSchemaLocation="retrieve.xsd">
  <Header>
    <ID>TSLF</ID>
    <Test>false</Test>
    <Name lang="en">TSLDF</Name>
    <Prepared>2021-10-28</Prepared>
    <Sender id="FRBNY">
      <Name lang="en">Federal Reserve Bank of New York</Name>
      <Contact>
        <Name lang="en">Public Information Web Team</Name>
        <Email>ny.piwebteam@ny.frb.org</Email>
      </Contact>
    </Sender>
  </Header>
  <DataSet>
    <Group AUCTION_STATUS="C" AVAILABILITY="A" DISCLAIMER="G" LAST_UPDATED="2016-01-30T18:52:30-05:00" OBS_STATUS="F" OPERATION_ID="TSLF2 010710" TIME_FORMAT="PT1M">
      <Section AUCTION_CLOSE_TIME="2016-01-30T14:30:00-05:00" AUCTION_COLLATERAL_TYPE="S2" AUCTION_START_TIME="2016-01-30T14:00:00-05:00" MATURITY_DATE="2010-02-05T00:00:00-05:00" SECTION_TYPE="ANNOUNCEMENT" SETTLEMENT_DATE="2010-01-08T00:00:00-05:00" TERM="28-day" TIME="2010-01-06">
        <OFFERING_AMOUNT CURRENCY_UNIT="USD" OBS_CONF="F" OBS_STATUS="A" UNIT_MULT="9" value="25.000"/>
        <MAX_AWARD_AMOUNT CURRENCY_UNIT="USD" OBS_CONF="F" OBS_STATUS="A" UNIT_MULT="9" value="5.000"/>
        <MIN_FEE_RATE DECIMALS="4" OBS_CONF="F" OBS_STATUS="A" UNIT_MULT="-2" value=".2500"/>
        <SECURITY_AMOUNT_AVAILABLE_FOR_LOAN CURRENCY_UNIT="USD" OBS_CONF="F" OBS_STATUS="A" SECURITY_DESCRIPTION="T 00.875 12/31/10" UNIT_MULT="6" value="4104"/>
        <SECURITY_AMOUNT_AVAILABLE_FOR_LOAN CURRENCY_UNIT="USD" OBS_CONF="F" OBS_STATUS="A" SECURITY_DESCRIPTION="T 00.875 04/30/11" UNIT_MULT="6" value="3080"/>
        <SECURITY_AMOUNT_AVAILABLE_FOR_LOAN CURRENCY_UNIT="USD" OBS_CONF="F" OBS_STATUS="A" SECURITY_DESCRIPTION="T 04.125 08/31/12" UNIT_MULT="6" value="3498"/>
        <SECURITY_AMOUNT_AVAILABLE_FOR_LOAN CURRENCY_UNIT="USD" OBS_CONF="F" OBS_STATUS="A" SECURITY_DESCRIPTION="T 04.250 11/15/14" UNIT_MULT="6" value="1654"/>
        <SECURITY_AMOUNT_AVAILABLE_FOR_LOAN CURRENCY_UNIT="USD" OBS_CONF="F" OBS_STATUS="A" SECURITY_DESCRIPTION="T 07.500 11/15/16" UNIT_MULT="6" value="5715"/>
        <SECURITY_AMOUNT_AVAILABLE_FOR_LOAN CURRENCY_UNIT="USD" OBS_CONF="F" OBS_STATUS="A" SECURITY_DESCRIPTION="T 04.000 08/15/18" UNIT_MULT="6" value="6946"/>
      </Section>
      <Section AUCTION_COLLATERAL_TYPE="S2" SECTION_TYPE="RESULTS">
        <PAR_ACCEPTED CURRENCY_UNIT="USD" OBS_CONF="F" OBS_STATUS="A" UNIT_MULT="6" value="0"/>
        <PAR_SUBMITTED CURRENCY_UNIT="USD" OBS_CONF="F" OBS_STATUS="A" UNIT_MULT="6" value="0"/>
        <BID_TO_COVER DECIMALS="2" OBS_CONF="F" OBS_STATUS="A" value=".00"/>
        <STOP_OUT_RATE DECIMALS="4" OBS_CONF="F" OBS_STATUS="A" value=".2500"/>
      </Section>
    </Group>
  </DataSet>
</CrossSectionalData>